{
  "meta": {
    "pageTitle": "יסודות · Yessodot — Integrative Psychedelic Clinic, Israel",
    "copyrightYear": "2026",
    "publishedAt": "2026-07-18T21:05:00Z"
  },
  "hero": {
    "eyebrow": "Israel",
    "headlineBefore": "Healing at the",
    "headlineEmphasis": "foundations",
    "headlineAfter": "of mind and body",
    "tagline": "Yessodot unites Israel's leading clinicians, researchers, and healing centers to bring psychedelic-assisted care to those conventional medicine has left behind.",
    "videoUrl": "1204006570",
    "ctaPrimary": "Apply for a Retreat",
    "ctaSecondary": "Learn more"
  },
  "crisis": {
    "eyebrow": "The crisis",
    "title": "When the best available care isn't enough",
    "paragraphs": [
      "In the wake of October 7 and ongoing military operations, Israel faces a quiet mental health emergency. A generation of elite, highly trained veterans is sidelined by what clinicians call the Polytrauma Triad: post-traumatic stress disorder, mild traumatic brain injury, and chronic pain.",
      "These conditions are biologically linked — forming a cycle of disability that conventional SSRIs and talk therapy often cannot break. These veterans have received the best care available, and still cannot return to functional life.",
      "The science now points toward a new frontier. Yessodot exists to bring it home."
    ],
    "stat1": {
      "value": "80%",
      "label": "Remission in PTSD and mTBI symptoms documented by Stanford University researchers studying ibogaine-assisted therapy — often after a single five-day treatment"
    },
    "stat2": {
      "value": "2,500+",
      "label": "US veterans treated in Mexico at various ibogaine clinics."
    },
    "stat3": {
      "value": "$100M",
      "label": "U.S. public-private investment in ibogaine research committed since 2025"
    }
  },
  "atmosphere": {
    "quote": "Healing happens in connection — at the close of a journey few thought they would take.",
    "attribution": "Yessodot · a moment of integration",
    "imageAlt": "Veterans and clinicians embracing at sunset at the close of a treatment retreat"
  },
  "approach": {
    "eyebrow": "Our approach",
    "title": "Three pillars of transformative care",
    "lead": "Yessodot integrates clinical rigor, therapeutic depth, and community support — because lasting healing requires all three working in concert.",
    "pillar1": {
      "title": "Clinical research",
      "body": "The world's first Phase 1 and Phase 2a ibogaine clinical trials, conducted at Sheba Medical Center's Sagol Neuroscience Center — building the gold-standard evidence base Israel's veterans deserve."
    },
    "pillar2": {
      "title": "Integrative therapy",
      "body": "Whole-person care at the Yessodot clinic — combining psychedelic-assisted sessions with rigorous preparation, therapeutic integration, and ongoing community support."
    },
    "pillar3": {
      "title": "Access and equity",
      "body": "Ensuring that treatment reaches those who need it most. Through scholarship programs and matched funding partnerships, no veteran's healing should be gated by their ability to pay."
    }
  },
  "science": {
    "eyebrow": "The science",
    "title": "What the research shows",
    "lead": "Ibogaine is not a fringe treatment. It is the subject of serious clinical attention at the world's leading institutions — and Israel is positioned to lead what comes next.",
    "point1": {
      "title": "Stanford University",
      "body": "Documented \"life-changing\" reductions in PTSD, depression, and anxiety among U.S. Special Operations veterans treated with ibogaine — often after a single treatment."
    },
    "point2": {
      "title": "University of Texas at Austin",
      "body": "Completed a 40-person observational ibogaine study and launched an $18 million dedicated psychedelic research center to advance the science further."
    },
    "point3": {
      "title": "U.S. federal investment",
      "body": "In 2025, Texas allocated $50 million for ibogaine research, matched by $50 million from a drug development partner — a $100 million public-private commitment to FDA-approved drug development."
    },
    "point4": {
      "title": "How it works",
      "body": "Ibogaine is a naturally occurring alkaloid from the iboga plant, native to Central Africa. Researchers hypothesize its effects on neuroplasticity may allow the brain to \"reset\" patterns of trauma, addiction, and chronic pain — particularly when paired with clinical preparation and integration."
    }
  },
  "evidence": {
    "eyebrow": "The evidence",
    "title": "Measurable recovery",
    "lead": "In the RESET-VET observational program, veterans were assessed on two validated clinical measures before and after a single ibogaine-assisted treatment. Symptom scores fell across both measures, with post-treatment results below the PTSD clinical threshold.",
    "source": "Track 1 preliminary Outcome · Sheba Medical Center · May 2026",
    "captionBold": "RESET-VET: global disability and PTSD symptom trajectories.",
    "caption": "Group means across global disability (WHODAS-2.0) and PTSD (PCL-5) declined from pre-treatment screening to post-treatment follow-up. Preliminary observational data (n = 7 veterans with post-treatment follow-up).",
    "chartAlt": "RESET-VET symptom trajectories before and after ibogaine treatment across Global Disability and PTSD — group means decline"
  },
  "partners": {
    "eyebrow": "Our partners",
    "title": "A coalition built for impact",
    "lead": "Yessodot brings together Israel's foremost medical institutions and global pioneers in psychedelic medicine.",
    "partner1": {
      "badge": "Research",
      "name": "Sheba Medical Center",
      "description": "Home to the Sagol Neuroscience Center and the site of Israel's first formal ibogaine clinical trials. Led by Professor Raquel C. Gardner, MD — a behavioral neurologist trained at Harvard and UCSF with extensive experience treating complex combat trauma at the San Francisco VA Medical Center."
    },
    "partner2": {
      "badge": "Clinical",
      "name": "Yessodot",
      "description": "Yessodot conducts clinical ibogaine-assisted therapy research in partnership with Sheba Medical Center focused on treatment-resistant PTSD, mTBI, and related conditions. Our program is built on decades of combined clinical experience and a treatment history spanning thousands of patients, with a safety record maintained through rigorous cardiac screening, medical supervision, and post-treatment protocols."
    },
    "partner3": {
      "badge": "Community",
      "name": "Yessodot Clinic",
      "description": "An integrative psychedelic clinic offering whole-person care that weaves together medical expertise, therapeutic depth, and community. The heart of Yessodot's healing practice in Israel."
    }
  },
  "leadership": {
    "eyebrow": "The Team",
    "title": "The people behind the work",
    "lead": "Yessodot is led by clinicians, researchers, and advocates who have dedicated their careers to healing at the frontier of medicine.",
    "leader1": {
      "name": "Arik Metzer",
      "title": "",
      "bio": "Arik Metzer is a Tel Aviv-based psychotherapist specializing in trauma and PTSD, following a senior leadership career in high-tech. He leads Yessodot's clinical work, shaping its trauma treatment programs and evidence-informed care for veterans.",
      "photo": "assets/team-arik.jpg",
      "photoPosition": "center center"
    },
    "leader2": {
      "name": "Boaz Wachtel",
      "title": "",
      "bio": "Boaz Wachtel is a medicalization activist and co-author of the Ibogaine Treatment Manual, with decades of experience advancing patient-centered psychedelic care. He brings advocacy expertise and institutional knowledge to Yessodot's mission of expanding veterans' access to ibogaine treatment.",
      "photo": "assets/team-boaz.jpg",
      "photoPosition": "center center"
    },
    "leader3": {
      "name": "David Lankri, Ph.D.",
      "title": "",
      "bio": "David Lankri is a medicinal chemist and neuropharmacologist at Columbia University, where he synthesizes novel iboga alkaloids and studies how they act on the brain. He provides Yessodot with scientific expertise on the chemistry and pharmacology of ibogaine.",
      "photo": "assets/team-david.jpg",
      "photoPosition": "center center"
    },
    "leader4": {
      "name": "Marissa Feinberg",
      "title": "",
      "bio": "Marissa Feinberg is a strategic communications leader specializing in emerging therapies. She leads Yessodot's media strategy and program oversight, building awareness and support for veterans' access to ibogaine treatment.",
      "photo": "assets/team-marissa.jpg",
      "photoPosition": "center center"
    },
    "leader5": {
      "name": "Yael Levy",
      "title": "",
      "bio": "Yael Levy is an operations professional with a background in therapeutic practice. She manages Yessodot's administration, logistics, and participant coordination, creating a structured and supportive experience for veterans in the program.",
      "photo": "assets/team-yael.jpg",
      "photoPosition": "center center"
    }
  },
  "donate": {
    "eyebrow": "Give",
    "title": "Your gift funds what comes next",
    "lead": "Support the world's first clinical trials of ibogaine for IDF veterans — and help build a future where \"treatment-resistant\" no longer means \"without hope.\"",
    "email": "info@yessodot.org",
    "ctaText": "Make a gift",
    "tier1": {
      "amount": "$7,500",
      "impact": "Funds 1 veteran's full treatment"
    },
    "tier2": {
      "amount": "$15,000",
      "impact": "Funds 2 veterans' treatment"
    },
    "tier3": {
      "amount": "$60,000",
      "impact": "Funds 8 veterans in a cohort"
    },
    "tier4": {
      "amount": "$120,000",
      "impact": "Funds a full cohort of 16"
    }
  }
}
